{
  "schemaVersion": "0.1.0",
  "artifact": {
    "kind": "glb",
    "path": "cache/scene.glb",
    "sha256": "aaaaaaaaaaaaaaaaaaaaaaaaaaaaaaaaaaaaaaaaaaaaaaaaaaaaaaaaaaaaaaaa"
  },
  "sourceCommit": "d49072a3775239e86d6d28e319017edb6dba6334",
  "toolchainManifestSha256": "a98c1a034ff3d6e6ca76ed3e386ab823602c075a594abfe409360aacafb649c1",
  "producer": {
    "name": "teldra-web-export",
    "version": "0.0.0"
  },
  "components": {
    "python": "3.12",
    "uv": "0.12.19",
    "ifcopenshell": "0.9.0"
  },
  "settingsSha256": "bbbbbbbbbbbbbbbbbbbbbbbbbbbbbbbbbbbbbbbbbbbbbbbbbbbbbbbbbbbbbbbb",
  "inputs": [
    {
      "path": "building.ifc",
      "sha256": "cccccccccccccccccccccccccccccccccccccccccccccccccccccccccccccccc"
    }
  ]
}
